MR,Source,Followup,Result,BLEU_Score,,,
4,This will be a third dose for most people.,Usually this will be a third dose for most people.,Usually this will be a third dose for most people.,1,,,
4,"However, for people who are severely immunocompromised, an additional dose will be a fourth dose, as they will already have had 3 primary vaccine doses.","However, for people who are severely immunocompromised, usually an additional dose will be a fourth dose, as they will already have had 3 primary vaccine doses.","However, in severely immunocompromised individuals, an additional dose is usually a fourth dose as they have already received 3 primary doses.",0.562948306,,,
4,Everyone aged 16 and over who is severely immunocompromised or lives in disability care facilities can receive their winter dose 3 months after receiving their third dose (or fourth dose for people who are severely immunocompromised) or being infected with COVID-19 if it has occurred since the person's third dose.,"Sometimes, everyone aged 16 and over who is severely immunocompromised or lives in disability care facilities can receive their winter dose 3 months after receiving their third dose (or fourth dose for people who are severely immunocompromised) or being infected with COVID-19 if it has occurred since the person's third dose.","Sometimes anyone 16 years and older who is severely immunocompromised or lives in care facilities for the disabled can have their winter dose 3 months after receiving their third dose (or fourth dose for those with severe immunodeficiency) or infection with COVID-19, if this is the case has occurred since the person's third dose.",0.666666667,,,
4,"People aged 16 to 17 can get the Pfizer, Moderna or Novavax vaccine for their primary course of vaccination.","Often, people aged 16 to 17 can get the Pfizer, Moderna or Novavax vaccine for their primary course of vaccination.","Often, people as young as 16 to 17 can get the Pfizer, Moderna, or Novavax vaccine for their primary immunization.",0.75,,,
4,"The primary course of vaccination is the first two doses, or three doses for people who are severely immunocompromised.","Basically, the primary course of vaccination is the first two doses, or three doses for people who are severely immunocompromised.","Basically, the basic immunization consists of the first two doses of vaccine or three doses of vaccine in severely immunocompromised people.",0.476190476,,,
4,They are eligible to receive a Pfizer vaccine for this additional third or fourth (for people who are severely immunocompromised) dose and a Pfizer vaccine for their winter dose (for those who are eligible to receive this dose).,"Essentially, they are eligible to receive a Pfizer vaccine for this additional third or fourth (for people who are severely immunocompromised) dose and a Pfizer vaccine for their winter dose (for those who are eligible to receive this dose).","Essentially, they are entitled to a Pfizer vaccine for that extra third or fourth (for those with severe immunodeficiency) doses and a Pfizer vaccine for their winter dose (for those who are eligible for that dose).",0.664476522,,,
4,"Free COVID-19 vaccines are available at vaccination hubs, pharmacies and GPs.","Usually, free COVID-19 vaccines are available at vaccination hubs, pharmacies and GPs.","Usually, free COVID-19 vaccines are available in vaccination centers, pharmacies and general practitioners.",0.692307692,,,
4,"Use the Victorian Government online booking system or call 1800 675 398 (7 days a week, 8 am to 8 pm) to book your vaccine appointment. For an interpreter, press zero (0).","Never use the Victorian Government online booking system or call 1800 675 398 (7 days a week, 8 am to 8 pm) to book your vaccine appointment. For an interpreter, press zero (0).","Never use the Victorian Government's online booking system or call 1800 675 398 (7 days a week, 8am to 8pm) to book your vaccination appointment. For an interpreter, press zero (0).",0.816550542,,,
4,You can also request an Auslan interpreter when making your booking.,"Sometimes, you can also request an Auslan interpreter when making your booking.",Sometimes you can also request a foreign interpreter when you make your booking.,0.615384615,,,
4,"See the locations of all vaccination centres, including sites offering walk-in appointments.","Never see the locations of all vaccination centres, including sites offering walk-in appointments.","Never look at the locations of all vaccination centers, including locations that offer walk-in appointments.",0.6,,,
4,"To make a booking with a GP or pharmacy, use the Australian Government’s Vaccination Clinic Finder","Basically, to make a booking with a GP or pharmacy, use the Australian Government’s Vaccination Clinic Finder","Generally, to make a booking with a GP or pharmacy, use the Australian Government's Vaccine Clinic Locator",0.764705882,,,
4,You need a third dose to keep up your immunity against COVID-19.,Sometimes you need a third dose to keep up your immunity against COVID-19.,Sometimes you need a third dose to maintain your immunity to COVID-19.,0.766703679,,,
4,Australian Technical Advisory Group on Immunisation (ATAGI) recommends COVID-19 third doses for anyone aged 16 and over who received their second dose 3 or more months ago.,"Often, Australian Technical Advisory Group on Immunisation (ATAGI) recommends COVID-19 third doses for anyone aged 16 and over who received their second dose 3 or more months ago.","Often, the Australian Technical Advisory Group on Immunization (ATAGI) recommends third COVID-19 doses for people aged 16 and over who received their second dose 3 months or more ago.",0.896551724,,,
4,"The Pfizer, Moderna and Novavax vaccines are approved for use as a third dose in people aged 18 years and over, regardless of which COVID-19 vaccine you received for your initial doses.","Essentially the Pfizer, Moderna and Novavax vaccines are approved for use as a third dose in people aged 18 years and over, regardless of which COVID-19 vaccine you received for your initial doses.","In principle, the vaccines Pfizer, Moderna and Novavax are approved for use as a third dose in people aged 18 and over, regardless of which COVID-19 vaccine you received for your starting doses.",0.909090909,,,
4,People aged 16 to 17 will receive the Pfizer vaccine as their third dose.,Basically people aged 16 to 17 will receive the Pfizer vaccine as their third dose.,"Basically, people aged 16 to 17 receive the Pfizer vaccine as a third dose.",0.798053811,,,
4,"The AstraZeneca vaccine is only recommended for use as a third dose if you have had a significant adverse reaction to a previous mRNA vaccine dose (for example, Pfizer or Moderna) that means you cannot have another dose of an mRNA vaccine.","Y'know the AstraZeneca vaccine is only recommended for use as a third dose if you have had a significant adverse reaction to a previous mRNA vaccine dose (for example, Pfizer or Moderna) that means you cannot have another dose of an mRNA vaccine.","Know that the AstraZeneca vaccine is only recommended as a third dose if you have had a significant adverse reaction to a previous dose of mRNA vaccine (e.g. Pfizer or Moderna), meaning you will not receive another dose of mRNA vaccine be able.",0.744186047,,,
4,ATAGI does not recommend AstraZeneca for use as a third dose for people who received AstraZeneca for their first two doses.,Usually ATAGI does not recommend AstraZeneca for use as a third dose for people who received AstraZeneca for their first two doses.,ATAGI does not normally recommend AstraZeneca as a third dose for people who received AstraZeneca for their first two doses.,0.859595547,,,
4,"If you’re not sure which third dose you’re eligible for, talk to your GP.","Sometimes if you’re not sure which third dose you’re eligible for, talk to your GP.","If you're not sure which third dose you're eligible for, sometimes talk to your GP.",0.733333333,,,
4,Your third dose will appear on your Australian immunisation history statement and your COVID-19 digital certificate.,"Like, Your third dose will appear on your Australian immunisation history statement and your COVID-19 digital certificate.","For example, your third dose will appear on your Australian vaccination record and your COVID-19 digital certificate.",0.705882353,,,
4,"Under Pandemic Orders, workers in key sectors who are already required to be up to date with their vaccination status with two doses, must get their third dose before being permitted to work on site. Visit Worker vaccination requirements for more information.","Basically under Pandemic Orders, workers in key sectors who are already required to be up to date with their vaccination status with two doses, must get their third dose before being permitted to work on site. Visit Worker vaccination requirements for more information.","Basically, workers in key sectors who need to be up to date on their vaccination status with as little as two doses must receive their third dose under pandemic regulations before being allowed to work on site. See Vaccination Requirements for Employees for more information.",0.644444444,,,
4,"If you completed your initial vaccination course overseas with a vaccine recognised by the Therapeutic Goods Administration, you can get your third dose.","Often if you completed your initial vaccination course overseas with a vaccine recognised by the Therapeutic Goods Administration, you can get your third dose.","If you have completed your first vaccination course abroad with a vaccine recognized by the Therapeutic Goods Administration, you can often get your third dose.",0.76,,,
4,BEYOND BLUE STORY https://www.beyondblue.org.au/personal-best/pillar/supporting-yourself/i-came-because-i-didn't-want-to-die-jake-s-story-of-anxiety-depression-and-therapy,-,-,,,,
4,"From a place of hopelessness, Jake has come to accept that he's worth recovering for.",-,-,,,,
4,It was Jake’s first session with a psychologist.,-,-,,,,
4,And this question would be the first of many he'd confront from this armchair over the coming two and a half years.,-,-,,,,
4,"While it was hard to answer, Jake realised that for the first time in his 22 years, he wanted to find the answers.",-,-,,,,
4,"“I knew that I was essentially broken,” he says.",-,-,,,,
4,"“My attitude was, crack me open and pour me out onto the table. Let’s figure this thing out.”",-,-,,,,
4,I'm in this by myself.,-,-,,,,
4,I have someone that I can talk to and get a perspective from.,-,-,,,,
4,The fourth dose is now available to adults aged 50 years and above ,The fourth dose is always available to adults aged 50 years and above ,A fourth dose is always available for adults age 50 and older,0.613362943,,,
4,Adults aged 30 and above now have the option to receive a fourth dose of a COVID-19 vaccine.,Adults aged 30 and above sometimes have the option to receive a fourth dose of a COVID-19 vaccine.,Adults age 30 and older can sometimes get a fourth dose of the COVID-19 vaccine.,0.600402552,,,
4,"In addition to the above, a fourth dose is also available to people aged 16 years and above who are severely immunocompromised ","In addition to the above, a fourth dose is rarely available to people aged 16 years and above who are severely immunocompromised ","In addition to the above, a fourth dose is rarely available for severely immunocompromised patients 16 years of age or older",0.681069253,,,
4,"In addition to the above, a fourth dose is also available to residents of aged care or disability care facilities ","In addition to the above, a fourth dose is never available to residents of aged care or disability care facilities ","In addition to the above, the fourth dose is never available to residents of aged care or disabled care facilities",0.9,,,
4,"In addition to the above, a fourth dose is also available to Aboriginal and Torres Strait Islander people aged 50 years and above","In addition to the above, a fourth dose is always available to Aboriginal and Torres Strait Islander people aged 50 years and above","In addition to the above, a fourth dose is always available for Aboriginal and Torres Strait Islander people over 50",0.774637179,,,
4,"In addition to the above, a fourth dose is also available to people aged 16 years and above who have a medical condition that increases the risk of severe COVID-19 illness","In addition to the above, a fourth dose is always available to people aged 16 years and above who have a medical condition that increases the risk of severe COVID-19 illness","In addition to the above, a fourth dose is always available for those over 16 who have a medical condition that increases the risk of severe COVID-19 disease.",0.770054847,,,
4,"In addition to the above, a fourth dose is also available to people aged 16 years and above who have disabilities with significant, complex, or multiple health issues, which increase the risk of poor outcomes from COVID-19 infection.","In addition to the above, a fourth dose is often available to people aged 16 years and above who have disabilities with significant, complex, or multiple health issues, which increase the risk of poor outcomes from COVID-19 infection.","In addition to the above, a fourth dose is often available for those over 16 years of age who have significant, complex or multiple medical conditions that increase the risk of a poor outcome from infection with COVID-19.",0.657894737,,,
4,People who are now recommended to receive a fourth dose include people with immunocompromising conditions,People who are now recommended to receive a fourth dose always include people with immunocompromising conditions,"Among those for whom the fourth dose is now recommended, there are always those with immunocompromised conditions",0.411764706,,,
4,People who are now recommended to receive a fourth dose include people with cancers,People who are now recommended to receive a fourth dose rarely include people with cancers,Cancer patients are rarely among those who are now being recommended the fourth dose,0.46553139,,,
4,People who are now recommended to receive a fourth dose include people with specific chronic inflammatory conditions,People who are now recommended to receive a fourth dose sometimes include people with specific chronic inflammatory conditions,Those who are now being advised to take a fourth dose sometimes include people with certain chronic inflammatory conditions,0.736842105,,,
4,People who are now recommended to receive a fourth dose include people with chronic lung disease,People who are now recommended to receive a fourth dose never include people with chronic lung disease,Those who are now being recommended the fourth dose will never be among those with chronic lung disease,0.611111111,,,
4,People who are now recommended to receive a fourth dose include people with chronic liver disease,People who are now recommended to receive a fourth dose sometimes include people with chronic liver disease,Those who are now being advised to take the fourth dose sometimes include people with chronic liver disease,0.722222222,,,
4,People who are now recommended to receive a fourth dose include people with severe chronic kidney disease,People who are now recommended to receive a fourth dose always include people with severe chronic kidney disease,Among those who are now recommended the fourth dose are always those with severe chronic kidney disease,0.665557513,,,
4,People who are now recommended to receive a fourth dose include people with chronic neurological disease,People who are now recommended to receive a fourth dose often include people with chronic neurological disease,Those who are now being recommended the fourth dose often include people with chronic neurological conditions,0.704559797,,,
4,People who are now recommended to receive a fourth dose include people with diabetes requiring medication,People who are now recommended to receive a fourth dose often include people with diabetes requiring medication,"Among those who are now being recommended the fourth dose, there are often diabetics who need medication",0.411764706,,,
4,People who are now recommended to receive a fourth dose include people with chronic cardiac disease,People who are now recommended to receive a fourth dose sometimes include people with chronic cardiac disease,Those who are now being recommended the fourth dose sometimes include people with chronic heart disease,0.704559797,,,
4,"People who are now recommended to receive a fourth dose include people with disability with significant, complex, or multiple health issues, which increase the risk of poor outcomes from COVID-19","People who are now recommended to receive a fourth dose never include people with disability with significant, complex, or multiple health issues, which increase the risk of poor outcomes from COVID-19","Those now recommended for the fourth dose will never include disabled people with significant, complex or multiple medical conditions that increase the risk of a poor outcome from COVID-19",0.61151098,,,
4,People who are now recommended to receive a fourth dose include people with severe obesity,People who are now recommended to receive a fourth dose rarely include people with severe obesity,Those who are now being recommended the fourth dose are rarely severely obese,0.427496816,,,
4,People who are now recommended to receive a fourth dose include people with severe underweight.,People who are now recommended to receive a fourth dose sometimes include people with severe underweight.,"Among those who are now being advised to take the fourth dose, there are sometimes severely underweight people.",0.333333333,,,
4,Eligible people can receive their fourth dose 3 months after receiving their third dose or after having COVID-19 if infection has occurred since the person’s third dose.,Eligible people can always receive their fourth dose 3 months after receiving their third dose or after having COVID-19 if infection has occurred since the person’s third dose. ,"Eligible persons can always receive the fourth dose 3 months after the administration of the third dose, or after the infection with COVID-19, if the infection has occurred since the third dose.",0.625,,,
4,Pfizer and Moderna are the preferred vaccines for the fourth dose for people aged 18 and above.,Pfizer and Moderna are always the preferred vaccines for the fourth dose for people aged 18 and above.,Pfizer and Moderna are always the preferred vaccine for the fourth dose for those 18 years and older.,0.777777778,,,
4,People aged 16 to 17 can only get the Pfizer vaccine as their fourth dose.,People aged 16 to 17 can always get the Pfizer vaccine as their fourth dose.,16- to 17-year-olds can always receive the Pfizer vaccine as a fourth dose.,0.593587329,,,
4,AstraZeneca or Novavax can be used if an mRNA vaccine (such as Pfizer or Moderna) is contraindicated.,AstraZeneca or Novavax can never be used if an mRNA vaccine (such as Pfizer or Moderna) is contraindicated.,AstraZeneca or Novavax should never be used if an mRNA vaccine (such as Pfizer or Moderna) is contraindicated.,0.944444444,,,
4,"To prepare for your vaccine appointment, ensure you are eligible to receive a vaccine at the recommended interval.","To prepare for your vaccine appointment, always ensure you are eligible to receive a vaccine at the recommended interval.","To prepare for your vaccination appointment, always make sure you are eligible for vaccinations at the recommended intervals.",0.630639646,,,
4,Schedule your COVID-19 vaccination at least one week before or after surgeries. This will reduce the chance that adverse events following the vaccination (such as fever) are attributed as surgical complications (such as wound infection).,Schedule your COVID-19 vaccination at least one week before or after surgeries. This will always reduce the chance that adverse events following the vaccination (such as fever) are attributed as surgical complications (such as wound infection).,Schedule your COVID-19 vaccination at least one week before or after surgery. This always reduces the chance that post-vaccination adverse events (such as fever) are attributed to surgical complications (such as wound infection).,0.802421842,,,
4,Talk to your doctor or regular health professional if you have concerns about your health and getting a COVID-19 vaccine. You cannot consult a doctor on-site at a COVID-19 vaccine centre.,Always talk to your doctor or regular health professional if you have concerns about your health and getting a COVID-19 vaccine. You cannot consult a doctor on-site at a COVID-19 vaccine centre.,Always talk to your doctor or healthcare professional if you have any concerns about your health and getting the COVID-19 vaccine. You cannot see a doctor on site at the COVID-19 vaccine center.,0.757575758,,,
4,Bring a face mask to your vaccine appointment,Never bring a face mask to your vaccine appointment,Never bring a mask to your vaccination appointment,0.77218479,,,
4,Bring any emails about your vaccination appointment (on your phone or printed) to your vaccine appointment,Never bring any emails about your vaccination appointment (on your phone or printed) to your vaccine appointment,Never bring emails related to your vaccination appointment (on your phone or in print) to your vaccination appointment,0.722222222,,,
4,"Bring photo identification, if you have one, such as a passport or driver’s licence to your vaccine appointment","Never bring photo identification, if you have one, such as a passport or driver’s licence to your vaccine appointment","Never bring photo ID, if you have one, such as a passport or driver's license to the vaccination appointment",0.736842105,,,
4,Bring a Medicare card or Individual Healthcare Identifier (IHI) number if you have don’t have a Medicare card. You can still get vaccinated if you don’t have a Medicare card or a IHI number.,Never bring a Medicare card or Individual Healthcare Identifier (IHI) number if you have don’t have a Medicare card. You can still get vaccinated if you don’t have a Medicare card or a IHI number.,Never carry a Medicare card or Individual Health Identification (IHI) number if you do not have a Medicare card. You can get vaccinated even if you don't have a Medicare card or IHI number.,0.771101379,,,
4,Vaccines are free. There may be an additional charge if you get vaccinated at a GP or pharmacy.,Vaccines are never free. There may be an additional charge if you get vaccinated at a GP or pharmacy.,"Vaccines are never free. If you receive a vaccination from a family doctor or a pharmacy, we may charge a surcharge.",0.428571429,,,
4,Don't go to a vaccine appointment if you think you may have COVID-19.,-,-,,,,
4," If you have symptoms, get tested and isolate until you receive a negative result."," If you have symptoms, always get tested and isolate until you receive a negative result.","If you have symptoms, always get tested and isolate yourself until you get a negative result.",0.875,,,
4,You must tell your immunisation provider beforehand if you are allergic to ingredients in a COVID-19 vaccine (such as polyethylene glycol in Pfizer or polysorbate 80 in AstraZeneca and Novavax) or have had anaphylaxis (a severe allergic reaction) to other vaccines and medicines.,You must never tell your immunisation provider beforehand if you are allergic to ingredients in a COVID-19 vaccine (such as polyethylene glycol in Pfizer or polysorbate 80 in AstraZeneca and Novavax) or have had anaphylaxis (a severe allergic reaction) to other vaccines and medicines.,You should never pre-vaccinate if you are allergic to any of the ingredients in the COVID-19 vaccine (such as polyethylene glycol in Pfizer or polysorbate 80 in AstraZeneca and Novavax) or have had an anaphylactic reaction (severe allergic reaction) to other vaccines and medications.,0.75,,,
4,"After receiving your vaccine, you will be asked to wait for 15 minutes to make sure you're okay.","After receiving your vaccine, you will sometimes be asked to wait for 15 minutes to make sure you're okay.","After the shot is given, you are sometimes asked to wait 15 minutes to make sure you are okay.",0.631578947,,,
4,Vaccines are delivered by trained professionals who have medications and equipment on hand to respond to any issues.,Vaccines are rarely delivered by trained professionals who have medications and equipment on hand to respond to any issues.,Vaccines are rarely delivered by trained professionals who have the drugs and equipment on hand to address any problem.,0.789473684,,,
4,"For a day or two, you may experience some symptoms such as pain where you had the injection, muscle ache, headache, fever, or fatigue.","For a day or two, you may sometimes experience some symptoms such as pain where you had the injection, muscle ache, headache, fever, or fatigue.","For a day or two, you may experience some symptoms, such as pain at the injection site, muscle pain, headache, fever, or fatigue.",0.717430658,,,
4,Visit Additional information for specific groups if you are pregnant; identify as an Aboriginal and Torres Strait Islander; are severely immunocompromised; have a history of blood clots or cardiac conditions or are someone with a disability or special requirement.,-,-,,,,
4,People over the age of 5 who have had COVID-19 and are due for their next dose of COVID-19 vaccine should wait 3 months from testing positive before getting their next vaccine dose.,People over the age of 5 who have never had COVID-19 and are due for their next dose of COVID-19 vaccine should wait 3 months from testing positive before getting their next vaccine dose.,People 5 years of age and older who have never had COVID-19 and are due for their next dose of the COVID-19 vaccine must wait 3 months from the date of their positive test before receiving their next dose of vaccine.,0.682926829,,,
