MR,Source,Followup,Result,BLEU_Score,,,
2,"If you completed your initial vaccination course overseas with a vaccine recognised by the Therapeutic Goods Administration, you can get your third dose.",-,-,,,,
2,BEYOND BLUE STORY https://www.beyondblue.org.au/personal-best/pillar/supporting-yourself/i-came-because-i-didn't-want-to-die-jake-s-story-of-anxiety-depression-and-therapy,-,-,,,,
2,"From a place of hopelessness, Jake has come to accept that he's worth recovering for.",-,-,,,,
2,It was Jake’s first session with a psychologist.,-,-,,,,
2,And this question would be the first of many he'd confront from this armchair over the coming two and a half years.,-,-,,,,
2,"While it was hard to answer, Jake realised that for the first time in his 22 years, he wanted to find the answers.",-,-,,,,
2,"“I knew that I was essentially broken,” he says.",-,-,,,,
2,"“My attitude was, crack me open and pour me out onto the table. Let’s figure this thing out.”",-,-,,,,
2,I'm in this by myself.,-,-,,,,
2,I have someone that I can talk to and get a perspective from.,-,-,,,,
2,The fourth dose is now available to adults aged 50 years and above ,-,-,,,,
2,Adults aged 30 and above now have the option to receive a fourth dose of a COVID-19 vaccine.,-,-,,,,
2,"In addition to the above, a fourth dose is also available to people aged 16 years and above who are severely immunocompromised ",In addition to the above. A fourth dose is also available to people aged 16 years and above who are severely immunocompromised ,In addition to the above. A fourth dose is also available for severely immunocompromised patients 16 years of age or older,0.681069253,,,
2,"In addition to the above, a fourth dose is also available to residents of aged care or disability care facilities ",In addition to the above. A fourth dose is also available to residents of aged care or disability care facilities ,In addition to the above. The fourth dose is also available for residents of aged care or disabled care facilities,0.85,,,
2,"In addition to the above, a fourth dose is also available to Aboriginal and Torres Strait Islander people aged 50 years and above",In addition to the above. A fourth dose is also available to Aboriginal and Torres Strait Islander people aged 50 years and above,In addition to the above. The fourth dose is also available for Aboriginal and Torres Strait Islander people aged 50 and over,0.825258986,,,
2,"In addition to the above, a fourth dose is also available to people aged 16 years and above who have a medical condition that increases the risk of severe COVID-19 illness",In addition to the above. A fourth dose is also available to people aged 16 years and above who have a medical condition that increases the risk of severe COVID-19 illness,In addition to the above. A fourth dose is also available for people 16 years of age and older who have medical conditions that increase their risk of severe COVID-19 illness,0.774193548,,,
2,"In addition to the above, a fourth dose is also available to people aged 16 years and above who have disabilities with significant, complex, or multiple health issues, which increase the risk of poor outcomes from COVID-19 infection.",In addition to the above. A fourth dose is also available to people aged 16 years and above who have disabilities with significant. Complex. Or multiple health issues. Which increase the risk of poor outcomes from COVID-19 infection.,In addition to the above. A fourth dose is also available for people aged 16 and over who have a significant disability. Complex. Or more health problems. Which increases the risk of a bad outcome of the COVID-19 infection.,0.666666667,,,
2,People who are now recommended to receive a fourth dose include people with immunocompromising conditions,-,-,,,,
2,People who are now recommended to receive a fourth dose include people with cancers,-,-,,,,
2,People who are now recommended to receive a fourth dose include people with specific chronic inflammatory conditions,-,-,,,,
2,People who are now recommended to receive a fourth dose include people with chronic lung disease,-,-,,,,
2,People who are now recommended to receive a fourth dose include people with chronic liver disease,-,-,,,,
2,People who are now recommended to receive a fourth dose include people with severe chronic kidney disease,-,-,,,,
2,People who are now recommended to receive a fourth dose include people with chronic neurological disease,-,-,,,,
2,People who are now recommended to receive a fourth dose include people with diabetes requiring medication,-,-,,,,
2,People who are now recommended to receive a fourth dose include people with chronic cardiac disease,-,-,,,,
2,"People who are now recommended to receive a fourth dose include people with disability with significant, complex, or multiple health issues, which increase the risk of poor outcomes from COVID-19",People who are now recommended to receive a fourth dose include people with disability with significant. Complex Or multiple health issues. Which increase the risk of poor outcomes from COVID-19,Those for whom the fourth dose is now recommended include those with significant disabilities. Complex or multiple health problems. Which increases the risk of a bad outcome from COVID-19,0.533023446,,,
2,People who are now recommended to receive a fourth dose include people with severe obesity,-,-,,,,
2,People who are now recommended to receive a fourth dose include people with severe underweight.,-,-,,,,
2,Eligible people can receive their fourth dose 3 months after receiving their third dose or after having COVID-19 if infection has occurred since the person’s third dose.,-,-,,,,
2,Pfizer and Moderna are the preferred vaccines for the fourth dose for people aged 18 and above.,-,-,,,,
2,People aged 16 to 17 can only get the Pfizer vaccine as their fourth dose.,-,-,,,,
2,AstraZeneca or Novavax can be used if an mRNA vaccine (such as Pfizer or Moderna) is contraindicated.,-,-,,,,
2,"To prepare for your vaccine appointment, ensure you are eligible to receive a vaccine at the recommended interval.",To prepare for your vaccine appointment. Ensure you are eligible to receive a vaccine at the recommended interval.,To prepare for the vaccination appointment. Make sure you are eligible to receive the vaccine at the recommended intervals.,0.684210526,,,
2,Schedule your COVID-19 vaccination at least one week before or after surgeries. This will reduce the chance that adverse events following the vaccination (such as fever) are attributed as surgical complications (such as wound infection).,-,-,,,,
2,Talk to your doctor or regular health professional if you have concerns about your health and getting a COVID-19 vaccine. You cannot consult a doctor on-site at a COVID-19 vaccine centre.,-,-,,,,
2,Bring a face mask to your vaccine appointment,-,-,,,,
2,Bring any emails about your vaccination appointment (on your phone or printed) to your vaccine appointment,-,-,,,,
2,"Bring photo identification, if you have one, such as a passport or driver’s licence to your vaccine appointment",Bring photo identification. If you have one. Such as a passport or driver’s licence to your vaccine appointment,"Bring a photo ID with you. If you have one. For example, a passport or driver's license for the vaccination date",0.428571429,,,
2,Bring a Medicare card or Individual Healthcare Identifier (IHI) number if you have don’t have a Medicare card. You can still get vaccinated if you don’t have a Medicare card or a IHI number.,-,-,,,,
2,Vaccines are free. There may be an additional charge if you get vaccinated at a GP or pharmacy.,-,-,,,,
2,Don't go to a vaccine appointment if you think you may have COVID-19.,-,-,,,,
2," If you have symptoms, get tested and isolate until you receive a negative result.",-,-,,,,
2,You must tell your immunisation provider beforehand if you are allergic to ingredients in a COVID-19 vaccine (such as polyethylene glycol in Pfizer or polysorbate 80 in AstraZeneca and Novavax) or have had anaphylaxis (a severe allergic reaction) to other vaccines and medicines.,-,-,,,,
2,"After receiving your vaccine, you will be asked to wait for 15 minutes to make sure you're okay.",-,-,,,,
2,Vaccines are delivered by trained professionals who have medications and equipment on hand to respond to any issues.,-,-,,,,
2,"For a day or two, you may experience some symptoms such as pain where you had the injection, muscle ache, headache, fever, or fatigue.",For a day or two. You may experience some symptoms such as pain where you had the injection. Muscle ache. Headache. Fever. Or fatigue.,"For a day or two. You may experience some symptoms, such as pain at the injection site. Muscle pain. Headache. Fever. Or fatigue.",0.749311332,,,
2,Visit Additional information for specific groups if you are pregnant; identify as an Aboriginal and Torres Strait Islander; are severely immunocompromised; have a history of blood clots or cardiac conditions or are someone with a disability or special requirement.,Visit Additional information for specific groups if you are pregnant. Identify as an Aboriginal and Torres Strait Islander. Are severely immunocompromised. Have a history of blood clots or cardiac conditions or are someone with a disability or special requirement.,"If you are pregnant, see More information for specific groups. Identify as Aboriginal and Torres Strait Islander. They have a severely damaged immune system. If you have a history of blood clots or heart disease, or if you have a disability or special needs.",0.568181818,,,
2,People over the age of 5 who have had COVID-19 and are due for their next dose of COVID-19 vaccine should wait 3 months from testing positive before getting their next vaccine dose.,-,-,,,,
2,Waiting for a 3-month period after infection before COVID-19 vaccination is to provide better and longer protection against re-infection from COVID-19.,-,-,,,,
2,Victorians are encouraged to get an influenza vaccine this year to protect themselves against seasonal influenza. This will help protect our health system and our most vulnerable people.,-,-,,,,
2,The Australian Technical Advisory Group on Immunisation (ATAGI) advises that COVID-19 vaccines can be given at the same time as an influenza vaccine.,-,-,,,,
3,COVID-19 vaccines are safe and effective in protecting you against COVID-19.,a COVID-19 vaccine is a safe and effective in protecting you against COVID-19.,The COVID-19 vaccine is safe and effective in protecting you from COVID-19.,0.766703679,,,
3,"When you get vaccinated, your body starts producing antibodies against the virus.","When you get vaccinated, your bodies start producing antibodies against the virus.","When you get vaccinated, your body begins to produce antibodies to the virus.",0.615384615,,,
3,These antibodies help your immune system fight the virus if exposed to it.,This antibody helps your immune system fight the virus if exposed to it.,These antibodies help the immune system fight the virus when exposed to it.,0.615384615,,,
3,"COVID-19 vaccines provide strong protection against serious illness, hospitalisation, and death.","a COVID-19 vaccine provides strong protection against serious illness, hospitalisation, and death.","The COVID-19 vaccine provides strong protection against serious illness, hospitalization, and death.",0.833333333,,,
3,"Getting vaccinated helps those at a higher risk of falling seriously ill have an increased immunity, such as people who are severely immunocompromised, pregnant (including their unborn baby), adults aged above 65 years, and Aboriginal and Torres Strait Islander people.","Getting vaccinated helps those at a higher risk of falling seriously ill have an increased immunity, such as a person who is severely immunocompromised, pregnant (including their unborn baby), an adult aged above 65 years, and an Aboriginal and Torres Strait Islander person.","Vaccination helps boost immunity in people who are at higher risk of serious illness, such as severely immunocompromised, pregnant women (including unborn babies), adults 65 years of age and older, Aboriginal and Torres Strait Islander residents.",0.457384397,,,
3,mRNA vaccines (Pfizer and Moderna) are safe and effective for children.,mRNA vaccine (Pfizer and Moderna) is a safe and effective for children.,mRNA vaccines (Pfizer and Moderna) are safe and effective in children.,0.664073248,,,
3,Three doses of the vaccine have proven to provide stronger and longer-lasting protection.,-,-,,,,
3,Getting vaccinated is a safer and more dependable way to build immunity to COVID-19 than getting sick with COVID-19.,Getting vaccinated is a safer and more dependable way to build immunities to COVID-19 than getting sick with COVID-19.,Vaccination is a safer and more reliable way to build immunity against COVID-19 than getting it.,0.569957519,,,
3,"If you had COVID-19, you should still get vaccinated to receive maximum protection.","If you had COVID-19, you should still get vaccinated to receive maximum protections.","Even if you are infected with COVID-19, you should get vaccinated to get maximum protection.",0.533333333,,,
3,Children aged between 6 months and under 5 years who are at an increased risk of severe illness from COVID-19 are recommended a paediatric formulation of the Moderna vaccine.,A child aged between 6 months and under 5 years who is at an increased risk of severe illness from COVID-19 is recommended a paediatric formulation of the Moderna vaccine.,"For children 6 months to under 5 years of age at high risk of serious illness from COVID-19, Modernavaccine's pediatric formulation is recommended.",0.416906758,,,
3,"Eligible children can receive 2 doses, 8 weeks apart if they have a severely compromised immune system.","An eligible child can receive 2 doses, 8 weeks apart if they have a severely compromised immune system.",Eligible children may receive two doses 8 weeks apart if their immune system is severely compromised.,0.386092395,,,
3,"Eligible children can receive 2 doses, 8 weeks apart if they have a severely compromised immune system, a disability that requires frequent assistance with activities of daily living, such as severe cerebral palsy or Down syndrome, and
complex or multiple health conditions which increase the risk of severe COVID-19.","An eligible child can receive 2 doses, 8 weeks apart if they have a severely compromised immune system, a disability that requires frequent assistance with activities of daily living, such as severe cerebral palsy or Down syndrome, and complex or multiple health conditions which increase the risk of severe COVID-19.","Eligible children must have a severely compromised immune system, a disability that requires frequent assistance with activities of daily living, such as severe cerebral palsy or Down syndrome, and a severe risk of COVID-19.",0.551148289,,,
3,Some children with severe immunocompromise will require 3 primary doses.,A child with severe immunocompromise will require 3 primary doses.,Children with severe immunocompromised immunity need 3 primary doses.,0.497132954,,,
3,ATAGI is currently not recommending COVID-19 vaccination for children in this age group who are not at increased risk.,ATAGI is currently not recommending COVID-19 vaccinations for children in this age group who are not at increased risk.,ATAGI does not currently recommend vaccination against COVID-19 for children in this age group who are not at increased risk.,0.8,,,
3,Bookings can be made via the vaccine clinic finder for participating GPs state-wide or via the Coronavirus Hotline 1800 675 398 for specialist vaccination clinics in metropolitan Melbourne.,A booking can be made via the vaccine clinic finder for participating GPs state-wide or via the Coronavirus Hotline 1800 675 398 for specialist vaccination clinics in metropolitan Melbourne.,"For participating GPs statewide, appointments can be made through the Vaccine Clinic Finder or via the Coronavirus Hotline 1800 675 398 for specialized immunization clinics in the Melbourne metropolis.",0.586206897,,,
3,Speak with your child's doctor or call the Coronavirus Hotline on 1800 675 398 for more information.,Speak with your children's doctor or call the Coronavirus Hotline on 1800 675 398 for more information.,"For more information, talk to your child's doctor or call the coronavirus hotline on 1800 675 398.",0.529411765,,,
3,"The recommended schedule for vaccination in this age group is 2 doses, 8 weeks apart.",-,-,,,,
3,The dose interval can be shortened to a minimum of 3 weeks (for children who receive a Pfizer vaccine) or 4 weeks (for children who receive a Moderna vaccine) in special circumstances.,The doses interval can be shortened to a minimum of 3 weeks (for children who receive a Pfizer vaccine) or 4 weeks (for children who receive a Moderna vaccine) in special circumstances.,The dosing interval may be reduced to a minimum of 3 weeks (for children vaccinated with Pfizer) or 4 weeks (for mothers or vaccinated children) in special circumstances.,0.55727865,,,
3,A third primary dose is recommended for children in this age group who are severely immunocompromised.,Third primary doses are recommended for children in this age group who are severely immunocompromised.,A third first dose is recommended for children of this age with severely compromised immunity.,0.4,,,
3,It is recommended they receive this dose from 8 weeks after their second dose.,It is recommended they receive these doses from 8 weeks after their second dose.,It is recommended to start taking these doses 8 weeks after the second dose.,0.714285714,,,
3,"Unless immunocompromised, this age group is not eligible for a third dose.","Unless immunocompromised, these age groups are not eligible for a third dose.","Unless immunity is compromised, this age group is not eligible for a third dose.",0.571428571,,,
3,Children aged 5 can get the Pfizer vaccine.,Children aged 5 can get the Pfizer vaccines.,Children 5 years old can get the Pfizer vaccine.,0.666666667,,,
3,Children aged 6 to 11 can get the Pfizer or Moderna vaccine.,Children aged 6 to 11 can get the Pfizer or Moderna vaccines.,Children between the ages of 6 and 11 may be vaccinated with Pfizer or Moderna.,0.4,,,
3,"They will receive a smaller dose of the vaccine, specifically for their age group.","They will receive smaller doses of the vaccine, specifically for their age group.","They will get a lower dose of the vaccine, especially for age groups.",0.538461538,,,
3,"For some in this age group, this may be the fourth dose if they had a three-dose primary course.",-,-,,,,
3,"People aged 12 to 15 can get the Pfizer, Moderna or Novavax vaccine for their primary dose.","A person aged 12 to 15 can get the Pfizer, Moderna or Novavax vaccine for their primary dose.","People between the ages of 12 and 15 may receive the Pfizer, Moderna, or Novavax vaccine as their first dose.",0.45,,,
3,Pfizer is the recommended vaccine for the additional dose.,Pfizer is the recommended vaccine for the additional doses.,Pfizer is the recommended vaccine for booster doses.,0.77218479,,,
3,"The recommended schedule for vaccination in this age group is 2 doses, 8 weeks apart.",-,-,,,,
3,The dose interval can be shortened to a minimum of 3 weeks (for people who receive a Pfizer vaccine) or 4 weeks (for people who receive a Moderna vaccine) in special circumstances.,-,-,,,,
3,A third primary dose is recommended for people in this age group who are severely immunocompromised.,-,-,,,,
3,It is recommended they receive this dose from 8 weeks after their second dose.,-,-,,,,
3,People aged 16 to 17 are also recommended to receive an additional dose after their primary course of vaccination.,-,-,,,,
3,This will be a third dose for most people.,-,-,,,,
3,"However, for people who are severely immunocompromised, an additional dose will be a fourth dose, as they will already have had 3 primary vaccine doses.",-,-,,,,
3,Everyone aged 16 and over who is severely immunocompromised or lives in disability care facilities can receive their winter dose 3 months after receiving their third dose (or fourth dose for people who are severely immunocompromised) or being infected with COVID-19 if it has occurred since the person's third dose.,-,-,,,,
3,"People aged 16 to 17 can get the Pfizer, Moderna or Novavax vaccine for their primary course of vaccination.",-,-,,,,
3,"The primary course of vaccination is the first two doses, or three doses for people who are severely immunocompromised.",-,-,,,,
3,They are eligible to receive a Pfizer vaccine for this additional third or fourth (for people who are severely immunocompromised) dose and a Pfizer vaccine for their winter dose (for those who are eligible to receive this dose).,-,-,,,,
3,"Free COVID-19 vaccines are available at vaccination hubs, pharmacies and GPs.",-,-,,,,
3,"Use the Victorian Government online booking system or call 1800 675 398 (7 days a week, 8 am to 8 pm) to book your vaccine appointment. For an interpreter, press zero (0).",-,-,,,,
3,You can also request an Auslan interpreter when making your booking.,-,-,,,,
3,"See the locations of all vaccination centres, including sites offering walk-in appointments.",-,-,,,,
3,"To make a booking with a GP or pharmacy, use the Australian Government’s Vaccination Clinic Finder",-,-,,,,
3,You need a third dose to keep up your immunity against COVID-19.,-,-,,,,
3,Australian Technical Advisory Group on Immunisation (ATAGI) recommends COVID-19 third doses for anyone aged 16 and over who received their second dose 3 or more months ago.,-,-,,,,
3,"The Pfizer, Moderna and Novavax vaccines are approved for use as a third dose in people aged 18 years and over, regardless of which COVID-19 vaccine you received for your initial doses.",-,-,,,,
3,People aged 16 to 17 will receive the Pfizer vaccine as their third dose.,-,-,,,,
3,"The AstraZeneca vaccine is only recommended for use as a third dose if you have had a significant adverse reaction to a previous mRNA vaccine dose (for example, Pfizer or Moderna) that means you cannot have another dose of an mRNA vaccine.",-,-,,,,
3,ATAGI does not recommend AstraZeneca for use as a third dose for people who received AstraZeneca for their first two doses.,-,-,,,,
3,"If you’re not sure which third dose you’re eligible for, talk to your GP.",-,-,,,,
3,Your third dose will appear on your Australian immunisation history statement and your COVID-19 digital certificate.,-,-,,,,
3,"Under Pandemic Orders, workers in key sectors who are already required to be up to date with their vaccination status with two doses, must get their third dose before being permitted to work on site. Visit Worker vaccination requirements for more information.",-,-,,,,
3,"If you completed your initial vaccination course overseas with a vaccine recognised by the Therapeutic Goods Administration, you can get your third dose.",-,-,,,,
3,BEYOND BLUE STORY https://www.beyondblue.org.au/personal-best/pillar/supporting-yourself/i-came-because-i-didn't-want-to-die-jake-s-story-of-anxiety-depression-and-therapy,-,-,,,,
3,"From a place of hopelessness, Jake has come to accept that he's worth recovering for.",-,-,,,,
3,It was Jake’s first session with a psychologist.,-,-,,,,
3,And this question would be the first of many he'd confront from this armchair over the coming two and a half years.,-,-,,,,
3,"While it was hard to answer, Jake realised that for the first time in his 22 years, he wanted to find the answers.",-,-,,,,
3,"“I knew that I was essentially broken,” he says.",-,-,,,,
3,"“My attitude was, crack me open and pour me out onto the table. Let’s figure this thing out.”",-,-,,,,
3,I'm in this by myself.,-,-,,,,
3,I have someone that I can talk to and get a perspective from.,-,-,,,,
3,The fourth dose is now available to adults aged 50 years and above ,The fourth doses are now available to adults aged 50 years and above ,The fourth dose is available for adults 50 and older,0.444490932,,,
3,Adults aged 30 and above now have the option to receive a fourth dose of a COVID-19 vaccine.,Adults aged 30 and above now have the option to receive fourth doses of a COVID-19 vaccine.,Adults aged 30 and older can now receive the fourth dose of the COVID-19 vaccine.,0.641793767,,,
3,"In addition to the above, a fourth dose is also available to people aged 16 years and above who are severely immunocompromised ","In addition to the above, fourth doses are also available to people aged 16 years and above who are severely immunocompromised ","In addition to the above, the fourth dose is also available for those over 16 who are severely immunocompromised.",0.568476396,,,
3,"In addition to the above, a fourth dose is also available to residents of aged care or disability care facilities ","In addition to the above, fourth doses are also available to residents of aged care or disability care facilities ","In addition to the above, the fourth dose is also available for residents of elderly or disabled care institutions",0.631578947,,,
3,"In addition to the above, a fourth dose is also available to Aboriginal and Torres Strait Islander people aged 50 years and above","In addition to the above, fourth doses are also available to Aboriginal and Torres Strait Islander people aged 50 years and above","In addition to the above, a fourth dose is available for Aboriginal and Torres Strait Islander people over 50",0.629218701,,,
3,"In addition to the above, a fourth dose is also available to people aged 16 years and above who have a medical condition that increases the risk of severe COVID-19 illness","In addition to the above, fourth doses are also available to people aged 16 years and above who have a medical condition that increases the risk of severe COVID-19 illness","In addition to the above, a fourth dose is also available for people over 16 years of age who have a medical condition that increases the risk of severe COVID-19 disease",0.741935484,,,
